{
  "schema_version": "1.0.0",
  "capability": "geo-measure",
  "captured_at": "2026-06-03T00:00:00Z",
  "site_domain": "example.com",
  "experiment_id": "exp_test_rounds",
  "questions_version": "qv1",
  "planned_slots_per_question": 3,
  "notes": "synthetic test fixture; not case data",
  "actions": [
    {
      "action_id": "act_docs_page",
      "released_at": "2026-06-01T00:00:00Z",
      "release_evidence": "https://example.com/changelog#docs"
    }
  ],
  "observations": [
    {
      "id": "obs_r_b1",
      "captured_at": "2026-05-01T10:00:00Z",
      "platform": "ChatGPT",
      "terminal": "web",
      "prompt_id": "q_a_brand",
      "prompt_text": "Name a documentation host people use for public API docs.",
      "session_id": "test-base-1",
      "answer_text": "Example Docs is a documentation host.",
      "answer_hash": "sha256:faa9e041f27e4bd2028d0e5ea2700af8e0399b91e71061fcfe0cd2392cfed61b",
      "source_kind": "model-answer",
      "network_status": "not-used",
      "network_evidence": null,
      "cited_urls": [],
      "content_absorbed": false,
      "brand_mentioned": true,
      "recommended": false,
      "dynamic_fact_correct": "unknown",
      "evidence_complete": true,
      "exclusion_reason": null,
      "round_id": "r_base",
      "phase": "baseline",
      "question_version": "qv1",
      "facts_version": "fv1",
      "rubric_version": "rv1",
      "observation_line": "A",
      "language": "en",
      "region": "US",
      "visible_model": "synthetic-chatgpt",
      "personalization_status": "off",
      "sample_slot_id": "slot_1",
      "attempt_index": 1,
      "execution_status": "valid",
      "collection_method": "recorded_fixture",
      "answer_verdict": "correct"
    },
    {
      "id": "obs_r_b2f",
      "captured_at": "2026-05-01T10:05:00Z",
      "platform": "ChatGPT",
      "terminal": "web",
      "prompt_id": "q_a_brand",
      "prompt_text": "Name a documentation host people use for public API docs.",
      "session_id": "test-base-2",
      "answer_text": "Session failed before an answer appeared.",
      "answer_hash": "sha256:5eaee6a935e26c775c052f9b60fb96c5f7309b26e2ebaae55f9890792ae31cca",
      "source_kind": "model-answer",
      "network_status": "not-used",
      "network_evidence": null,
      "cited_urls": [],
      "content_absorbed": "unknown",
      "brand_mentioned": "unknown",
      "recommended": "unknown",
      "dynamic_fact_correct": "unknown",
      "evidence_complete": true,
      "exclusion_reason": null,
      "round_id": "r_base",
      "phase": "baseline",
      "question_version": "qv1",
      "facts_version": "fv1",
      "rubric_version": "rv1",
      "observation_line": "A",
      "language": "en",
      "region": "US",
      "visible_model": "synthetic-chatgpt",
      "personalization_status": "off",
      "sample_slot_id": "slot_2",
      "attempt_index": 1,
      "execution_status": "technical_failure",
      "collection_method": "recorded_fixture",
      "answer_verdict": "unknown"
    },
    {
      "id": "obs_r_b2r",
      "captured_at": "2026-05-01T10:10:00Z",
      "platform": "ChatGPT",
      "terminal": "web",
      "prompt_id": "q_a_brand",
      "prompt_text": "Name a documentation host people use for public API docs.",
      "session_id": "test-base-2b",
      "answer_text": "Example Docs publishes official API docs at example.com.",
      "answer_hash": "sha256:a59050e313a9b7a85e1907a36243c6c86ec50c5c9d68837f6d1d85bf1ca72d59",
      "source_kind": "model-answer",
      "network_status": "not-used",
      "network_evidence": null,
      "cited_urls": [],
      "content_absorbed": false,
      "brand_mentioned": true,
      "recommended": false,
      "dynamic_fact_correct": "unknown",
      "evidence_complete": true,
      "exclusion_reason": null,
      "round_id": "r_base",
      "phase": "baseline",
      "question_version": "qv1",
      "facts_version": "fv1",
      "rubric_version": "rv1",
      "observation_line": "A",
      "language": "en",
      "region": "US",
      "visible_model": "synthetic-chatgpt",
      "personalization_status": "off",
      "sample_slot_id": "slot_2",
      "attempt_index": 2,
      "execution_status": "valid",
      "replacement_of": "obs_r_b2f",
      "collection_method": "recorded_fixture",
      "answer_verdict": "correct"
    },
    {
      "id": "obs_r_b3",
      "captured_at": "2026-05-01T10:15:00Z",
      "platform": "ChatGPT",
      "terminal": "web",
      "prompt_id": "q_a_brand",
      "prompt_text": "Name a documentation host people use for public API docs.",
      "session_id": "test-base-3",
      "answer_text": "No brand is named in this answer.",
      "answer_hash": "sha256:4223d497fc8bbfd666294198eb14b8e001cdaf39325960c7dd7ba7ecc7992805",
      "source_kind": "model-answer",
      "network_status": "not-used",
      "network_evidence": null,
      "cited_urls": [],
      "content_absorbed": false,
      "brand_mentioned": false,
      "recommended": false,
      "dynamic_fact_correct": "unknown",
      "evidence_complete": true,
      "exclusion_reason": null,
      "round_id": "r_base",
      "phase": "baseline",
      "question_version": "qv1",
      "facts_version": "fv1",
      "rubric_version": "rv1",
      "observation_line": "A",
      "language": "en",
      "region": "US",
      "visible_model": "synthetic-chatgpt",
      "personalization_status": "off",
      "sample_slot_id": "slot_3",
      "attempt_index": 1,
      "execution_status": "valid",
      "collection_method": "recorded_fixture",
      "answer_verdict": "wrong"
    },
    {
      "id": "obs_r_a1",
      "captured_at": "2026-06-02T10:00:00Z",
      "platform": "ChatGPT",
      "terminal": "web",
      "prompt_id": "q_a_brand",
      "prompt_text": "Name a documentation host people use for public API docs.",
      "session_id": "test-after-1",
      "answer_text": "Example Docs remains a common documentation host.",
      "answer_hash": "sha256:7d95076e09f356ecbd43aad9469c0022c38f0b81a57676336969913b75f6b9d9",
      "source_kind": "model-answer",
      "network_status": "not-used",
      "network_evidence": null,
      "cited_urls": [],
      "content_absorbed": false,
      "brand_mentioned": true,
      "recommended": false,
      "dynamic_fact_correct": "unknown",
      "evidence_complete": true,
      "exclusion_reason": null,
      "round_id": "r_after",
      "phase": "after_release",
      "question_version": "qv1",
      "facts_version": "fv1",
      "rubric_version": "rv1",
      "observation_line": "A",
      "language": "en",
      "region": "US",
      "visible_model": "synthetic-chatgpt",
      "personalization_status": "off",
      "sample_slot_id": "slot_1",
      "attempt_index": 1,
      "execution_status": "valid",
      "collection_method": "recorded_fixture",
      "answer_verdict": "correct",
      "compared_action_ids": ["act_docs_page"]
    },
    {
      "id": "obs_r_a2",
      "captured_at": "2026-06-02T10:05:00Z",
      "platform": "ChatGPT",
      "terminal": "web",
      "prompt_id": "q_a_brand",
      "prompt_text": "Name a documentation host people use for public API docs.",
      "session_id": "test-after-2",
      "answer_text": "A generic documentation site exists.",
      "answer_hash": "sha256:3d21c945bb1585db720852c9c92b39c0ea7c593e4d43b2fb9e96b18813fd8323",
      "source_kind": "model-answer",
      "network_status": "not-used",
      "network_evidence": null,
      "cited_urls": [],
      "content_absorbed": false,
      "brand_mentioned": false,
      "recommended": false,
      "dynamic_fact_correct": "unknown",
      "evidence_complete": true,
      "exclusion_reason": null,
      "round_id": "r_after",
      "phase": "after_release",
      "question_version": "qv1",
      "facts_version": "fv1",
      "rubric_version": "rv1",
      "observation_line": "A",
      "language": "en",
      "region": "US",
      "visible_model": "synthetic-chatgpt",
      "personalization_status": "off",
      "sample_slot_id": "slot_2",
      "attempt_index": 1,
      "execution_status": "valid",
      "collection_method": "recorded_fixture",
      "answer_verdict": "wrong",
      "compared_action_ids": ["act_docs_page"]
    },
    {
      "id": "obs_r_a3",
      "captured_at": "2026-06-02T10:10:00Z",
      "platform": "ChatGPT",
      "terminal": "web",
      "prompt_id": "q_a_brand",
      "prompt_text": "Name a documentation host people use for public API docs.",
      "session_id": "test-after-3",
      "answer_text": "I cannot answer that.",
      "answer_hash": "sha256:05a2f6f74dea213f0e91eedf1d594e75297b155410919c99a5732055b5a79e42",
      "source_kind": "model-answer",
      "network_status": "not-used",
      "network_evidence": null,
      "cited_urls": [],
      "content_absorbed": false,
      "brand_mentioned": false,
      "recommended": false,
      "dynamic_fact_correct": "unknown",
      "evidence_complete": true,
      "exclusion_reason": null,
      "round_id": "r_after",
      "phase": "after_release",
      "question_version": "qv1",
      "facts_version": "fv1",
      "rubric_version": "rv1",
      "observation_line": "A",
      "language": "en",
      "region": "US",
      "visible_model": "synthetic-chatgpt",
      "personalization_status": "off",
      "sample_slot_id": "slot_3",
      "attempt_index": 1,
      "execution_status": "valid",
      "collection_method": "recorded_fixture",
      "answer_verdict": "no_answer",
      "compared_action_ids": ["act_docs_page"]
    }
  ]
}
