{
  "schema_version": "1.0.0",
  "capability": "geo-measure",
  "captured_at": "2026-08-11T06:30:00Z",
  "site_domain": "beefapi.com",
  "observations": [
    {
      "id": "obs_chatgpt_web_1",
      "captured_at": "2026-08-11T06:10:00Z",
      "platform": "ChatGPT",
      "terminal": "web",
      "prompt_id": "gpt-5-6-price",
      "prompt_text": "GPT-5.6 在 BeefAPI 现在多少钱？",
      "session_id": "fixture-chatgpt-1",
      "answer_text": "Used web search and cited beefapi.com pricing.",
      "answer_hash": "sha256:29dcc47bd8c5db277268b09583096c7a232279026f599acec5e82d6b2365b302",
      "source_kind": "model-answer",
      "network_status": "verified",
      "network_evidence": "fixture browser citation panel",
      "cited_urls": ["https://beefapi.com/pricing/gpt-5-6"],
      "content_absorbed": true,
      "brand_mentioned": true,
      "recommended": true,
      "dynamic_fact_correct": true,
      "evidence_complete": true,
      "exclusion_reason": null
    },
    {
      "id": "obs_chatgpt_app_2",
      "captured_at": "2026-08-11T06:11:00Z",
      "platform": "ChatGPT",
      "terminal": "app",
      "prompt_id": "gpt-5-6-price",
      "prompt_text": "GPT-5.6 在 BeefAPI 现在多少钱？",
      "session_id": "fixture-chatgpt-2",
      "answer_text": "BeefAPI prices mentioned without web access.",
      "answer_hash": "sha256:e27bd66ccd7a27023eb14a68e43eaea2908e73f37102b555117c71002826f2b9",
      "source_kind": "model-answer",
      "network_status": "not-used",
      "network_evidence": null,
      "cited_urls": [],
      "content_absorbed": true,
      "brand_mentioned": true,
      "recommended": false,
      "dynamic_fact_correct": false,
      "evidence_complete": true,
      "exclusion_reason": null
    },
    {
      "id": "obs_gemini_web_1",
      "captured_at": "2026-08-11T06:12:00Z",
      "platform": "Gemini",
      "terminal": "web",
      "prompt_id": "gpt-5-6-price",
      "prompt_text": "GPT-5.6 在 BeefAPI 现在多少钱？",
      "session_id": "fixture-gemini-1",
      "answer_text": "Gemini cited BeefAPI current pricing page.",
      "answer_hash": "sha256:a07c36555b0dfbcf343cd934f755f25596479b7d2cf63b773dcdecbfb3188104",
      "source_kind": "model-answer",
      "network_status": "verified",
      "network_evidence": "fixture linked-source panel",
      "cited_urls": ["https://beefapi.com/pricing.json"],
      "content_absorbed": true,
      "brand_mentioned": true,
      "recommended": true,
      "dynamic_fact_correct": true,
      "evidence_complete": true,
      "exclusion_reason": null
    },
    {
      "id": "obs_yuanbao_app_1",
      "captured_at": "2026-08-11T06:13:00Z",
      "platform": "Tencent Yuanbao",
      "terminal": "app",
      "prompt_id": "gpt-5-6-price",
      "prompt_text": "GPT-5.6 在 BeefAPI 现在多少钱？",
      "session_id": "fixture-yuanbao-1",
      "answer_text": "Yuanbao discussed BeefAPI but network status was unclear.",
      "answer_hash": "sha256:2ab25460c649080fdddc9de5e22b6d9b3c3e40e23e5564cb78cfeeb5c9391020",
      "source_kind": "model-answer",
      "network_status": "unknown",
      "network_evidence": null,
      "cited_urls": [],
      "content_absorbed": "unknown",
      "brand_mentioned": true,
      "recommended": "unknown",
      "dynamic_fact_correct": "unknown",
      "evidence_complete": true,
      "exclusion_reason": null
    },
    {
      "id": "obs_doubao_app_1",
      "captured_at": "2026-08-11T06:14:00Z",
      "platform": "Doubao",
      "terminal": "app",
      "prompt_id": "gpt-5-6-price",
      "prompt_text": "GPT-5.6 在 BeefAPI 现在多少钱？",
      "session_id": "fixture-doubao-1",
      "answer_text": "Doubao used the web but did not cite BeefAPI.",
      "answer_hash": "sha256:e22451c5db47b3b1d73484ada95cb9ebe0a51efb4d8d24884d53e371f4417ee5",
      "source_kind": "model-answer",
      "network_status": "verified",
      "network_evidence": "fixture network indicator",
      "cited_urls": ["https://example.com/other-source"],
      "content_absorbed": false,
      "brand_mentioned": true,
      "recommended": false,
      "dynamic_fact_correct": true,
      "evidence_complete": true,
      "exclusion_reason": null
    },
    {
      "id": "obs_deepseek_web_1",
      "captured_at": "2026-08-11T06:15:00Z",
      "platform": "DeepSeek",
      "terminal": "web",
      "prompt_id": "gpt-5-6-price",
      "prompt_text": "GPT-5.6 在 BeefAPI 现在多少钱？",
      "session_id": "fixture-deepseek-1",
      "answer_text": "DeepSeek answered from internal knowledge and omitted BeefAPI.",
      "answer_hash": "sha256:bcc5df2f25accb8e1bf1fa30fadb54c8f07b3713f177d977a8ddf4a8fa0d6012",
      "source_kind": "model-answer",
      "network_status": "not-used",
      "network_evidence": null,
      "cited_urls": [],
      "content_absorbed": false,
      "brand_mentioned": false,
      "recommended": false,
      "dynamic_fact_correct": false,
      "evidence_complete": true,
      "exclusion_reason": null
    },
    {
      "id": "obs_search_result_1",
      "captured_at": "2026-08-11T06:16:00Z",
      "platform": "ChatGPT",
      "terminal": "web",
      "prompt_id": "gpt-5-6-price",
      "prompt_text": "GPT-5.6 在 BeefAPI 现在多少钱？",
      "session_id": "fixture-search-1",
      "answer_text": "Ordinary search result snippet, not a model answer.",
      "answer_hash": "sha256:619ff09dd312ea4bef71157f2f7bb7c24a6de977a5b17ce098655b03ea3a962e",
      "source_kind": "ordinary-web-search-result",
      "network_status": "verified",
      "network_evidence": "ordinary search page only",
      "cited_urls": ["https://beefapi.com/pricing.json"],
      "content_absorbed": true,
      "brand_mentioned": true,
      "recommended": true,
      "dynamic_fact_correct": true,
      "evidence_complete": true,
      "exclusion_reason": null
    },
    {
      "id": "obs_incomplete_1",
      "captured_at": "2026-08-11T06:17:00Z",
      "platform": "Gemini",
      "terminal": "web",
      "prompt_id": "gpt-5-6-price",
      "prompt_text": "GPT-5.6 在 BeefAPI 现在多少钱？",
      "session_id": "fixture-incomplete-1",
      "answer_text": "Incomplete screenshot without full answer evidence.",
      "answer_hash": "sha256:33e7cf755f2c3d251d6dd1dbc348f3dd92bcc4e9b17e2035a516deb84740658c",
      "source_kind": "model-answer",
      "network_status": "verified",
      "network_evidence": null,
      "cited_urls": [],
      "content_absorbed": "unknown",
      "brand_mentioned": "unknown",
      "recommended": "unknown",
      "dynamic_fact_correct": "unknown",
      "evidence_complete": false,
      "exclusion_reason": "incomplete answer evidence"
    }
  ]
}
